0,1
Index,Page No.
Condensed Consolidated Balance Sheet ……………………………………………………………………………………………………………………..,
Condensed Consolidated Statement of Profit and Loss ……………………………………………………………………………………………………………………..,
Condensed Consolidated Statement of Changes in Equity ……………………………………………………………………………………………………………………..,
Condensed Consolidated Statement of Cash Flows ……………………………………………………………………………………………………………………..,
Overview and Notes to the Interim Condensed Consolidated Financial Statements,
1. Overview,
1.1 Company overview ……………………………………………………………………………………………………………………..,
